{
  "schema_version": 1,
  "season": 2026,
  "source": "planning.json",
  "cycles": [
    {
      "id": "2026-construccio-01",
      "name": "Construcció",
      "start": "2026-03-23",
      "end": "2026-05-31",
      "weeks": [
        {
          "id": "2026-03-23",
          "code": "2026-S13",
          "start": "2026-03-23",
          "end": "2026-03-29",
          "phase": "Acumulació",
          "summary": {
            "weekly_km_target": 20.7,
            "quality_km_target": 6.5,
            "z2_km_target": 5.7,
            "long_run_km_target": 8.5,
            "strength_plan": "S1",
            "padel_plan": "S"
          },
          "sessions": [
            {
              "id": "2026-S13-quality-01",
              "type": "quality",
              "sport": "running",
              "elevation_m": null,
              "variant": "road",
              "day": null,
              "distance_km": 6.5,
              "series": 3,
              "series_duration_min": 6,
              "pace_min_km": 5.83,
              "recovery_min": 2,
              "heart_rate": {
                "min": 164,
                "max": 170
              }
            },
            {
              "id": "2026-S13-z2-01",
              "type": "z2",
              "sport": "running",
              "elevation_m": null,
              "variant": "road",
              "day": null,
              "distance_km": 5.7,
              "duration_min": 45,
              "pace_min_km": {
                "min": 7.75,
                "max": 8
              },
              "heart_rate": {
                "min": 135,
                "max": 145
              }
            },
            {
              "id": "2026-S13-long-run-01",
              "type": "long-run",
              "sport": "running",
              "elevation_m": null,
              "variant": "road",
              "day": null,
              "distance_km": 8.5,
              "duration_min": 70,
              "description": "Z2 continu o Trail suau",
              "pace_min_km": null,
              "heart_rate": {
                "min": null,
                "max": null
              }
            },
            {
              "id": "2026-S13-strength-01",
              "type": "strength",
              "sport": "strength",
              "variant": null,
              "day": null,
              "session_type": "S1"
            },
            {
              "id": "2026-S13-padel-01",
              "type": "padel",
              "sport": "padel",
              "variant": null,
              "day": null,
              "label": "S"
            }
          ]
        },
        {
          "id": "2026-03-30",
          "code": "2026-S14",
          "start": "2026-03-30",
          "end": "2026-04-05",
          "phase": "Acumulació",
          "summary": {
            "weekly_km_target": 22.3,
            "quality_km_target": 7,
            "z2_km_target": 6.3,
            "long_run_km_target": 9,
            "strength_plan": "S2",
            "padel_plan": "S"
          },
          "sessions": [
            {
              "id": "2026-S14-quality-01",
              "type": "quality",
              "sport": "running",
              "elevation_m": null,
              "variant": "road",
              "day": null,
              "distance_km": 7,
              "series": 2,
              "series_duration_min": 10,
              "pace_min_km": 5.92,
              "recovery_min": 2.5,
              "heart_rate": {
                "min": 164,
                "max": 170
              }
            },
            {
              "id": "2026-S14-z2-01",
              "type": "z2",
              "sport": "running",
              "elevation_m": null,
              "variant": "road",
              "day": null,
              "distance_km": 6.3,
              "duration_min": 50,
              "pace_min_km": {
                "min": 7.75,
                "max": 8
              },
              "heart_rate": {
                "min": 135,
                "max": 145
              }
            },
            {
              "id": "2026-S14-long-run-01",
              "type": "long-run",
              "sport": "running",
              "elevation_m": null,
              "variant": "road",
              "day": null,
              "distance_km": 9,
              "duration_min": 75,
              "description": "Z2 continu o Trail suau",
              "pace_min_km": null,
              "heart_rate": {
                "min": null,
                "max": null
              }
            },
            {
              "id": "2026-S14-strength-01",
              "type": "strength",
              "sport": "strength",
              "variant": null,
              "day": null,
              "session_type": "S2"
            },
            {
              "id": "2026-S14-padel-01",
              "type": "padel",
              "sport": "padel",
              "variant": null,
              "day": null,
              "label": "S"
            }
          ]
        },
        {
          "id": "2026-04-06",
          "code": "2026-S15",
          "start": "2026-04-06",
          "end": "2026-04-12",
          "phase": "Acumulació",
          "summary": {
            "weekly_km_target": 23.3,
            "quality_km_target": 7.5,
            "z2_km_target": 6.3,
            "long_run_km_target": 9.5,
            "strength_plan": "S3",
            "padel_plan": "S"
          },
          "sessions": [
            {
              "id": "2026-S15-quality-01",
              "type": "quality",
              "sport": "running",
              "elevation_m": null,
              "variant": "road",
              "day": null,
              "distance_km": 7.5,
              "series": 3,
              "series_duration_min": 8,
              "pace_min_km": 5.83,
              "recovery_min": 2,
              "heart_rate": {
                "min": 164,
                "max": 170
              }
            },
            {
              "id": "2026-S15-z2-01",
              "type": "z2",
              "sport": "running",
              "elevation_m": null,
              "variant": "road",
              "day": null,
              "distance_km": 6.3,
              "duration_min": 50,
              "pace_min_km": {
                "min": 7.75,
                "max": 8
              },
              "heart_rate": {
                "min": 135,
                "max": 145
              }
            },
            {
              "id": "2026-S15-long-run-01",
              "type": "long-run",
              "sport": "running",
              "elevation_m": null,
              "variant": "road",
              "day": null,
              "distance_km": 9.5,
              "duration_min": 80,
              "description": "Z2 continu o Trail suau",
              "pace_min_km": null,
              "heart_rate": {
                "min": null,
                "max": null
              }
            },
            {
              "id": "2026-S15-strength-01",
              "type": "strength",
              "sport": "strength",
              "variant": null,
              "day": null,
              "session_type": "S3"
            },
            {
              "id": "2026-S15-padel-01",
              "type": "padel",
              "sport": "padel",
              "variant": null,
              "day": null,
              "label": "S"
            }
          ]
        },
        {
          "id": "2026-04-13",
          "code": "2026-S16",
          "start": "2026-04-13",
          "end": "2026-04-19",
          "phase": "Descàrrega",
          "summary": {
            "weekly_km_target": 18.5,
            "quality_km_target": 6,
            "z2_km_target": 5,
            "long_run_km_target": 7.5,
            "strength_plan": "S5",
            "padel_plan": "S"
          },
          "sessions": [
            {
              "id": "2026-S16-quality-01",
              "type": "quality",
              "sport": "running",
              "elevation_m": null,
              "variant": "road",
              "day": null,
              "distance_km": 6,
              "series": 2,
              "series_duration_min": 8,
              "pace_min_km": 5.92,
              "recovery_min": 2,
              "heart_rate": {
                "min": 162,
                "max": 168
              }
            },
            {
              "id": "2026-S16-z2-01",
              "type": "z2",
              "sport": "running",
              "elevation_m": null,
              "variant": "road",
              "day": null,
              "distance_km": 5,
              "duration_min": 40,
              "pace_min_km": {
                "min": 7.75,
                "max": 8
              },
              "heart_rate": {
                "min": 135,
                "max": 145
              }
            },
            {
              "id": "2026-S16-long-run-01",
              "type": "long-run",
              "sport": "running",
              "elevation_m": null,
              "variant": "road",
              "day": null,
              "distance_km": 7.5,
              "duration_min": 60,
              "description": "Z2 pla i molt fàcil",
              "pace_min_km": null,
              "heart_rate": {
                "min": null,
                "max": null
              }
            },
            {
              "id": "2026-S16-strength-01",
              "type": "strength",
              "sport": "strength",
              "variant": null,
              "day": null,
              "session_type": "S5"
            },
            {
              "id": "2026-S16-padel-01",
              "type": "padel",
              "sport": "padel",
              "variant": null,
              "day": null,
              "label": "S"
            }
          ]
        },
        {
          "id": "2026-04-20",
          "code": "2026-S17",
          "start": "2026-04-20",
          "end": "2026-04-26",